{
  "task_id": "TASK-PILOT-0001",
  "task_mode": "bridge",
  "project_id": "example_project",
  "application_id": "video_pipeline_ops",
  "required_protocol_version": "0.2",
  "required_capabilities": ["video_pipeline_execution"],
  "output_contract_ref": "bridge_objects/output_contract.json",
  "context_scope": "task_only",
  "context_expires_at": "2026-06-01T00:00:00Z",
  "input_refs": [
    "project://deployment_manifest.local.json",
    "project://sample_inputs/TASK-PILOT-0001/"
  ],
  "redactions": [
    "oauth_token",
    "client_secret",
    "full_channel_registry",
    "full_project_memory"
  ],
  "dispatch_policy": "capability_match",
  "target_mesh": "mesh-local-pilot",
  "assigned_agent": null,
  "risk_level": "low",
  "timeout_sec": 1800,
  "acceptance_criteria": [
    "final artifact exists",
    "artifact_refs include size_bytes and sha256",
    "log_refs include pipeline log",
    "RuntimeGuard guarded_verify result is pass",
    "ReviewResult references this task receipt"
  ],
  "validation_script_ref": "validators/bridge_loop_pilot.py",
  "contract_clarity_score": 4,
  "created_by": "project-authorized-issuer",
  "created_at": "2026-05-30T00:00:00Z",
  "source_refs": [
    "protocol/v0.2-pilot-plan.md"
  ],
  "source_proof": {
    "method": "hash_chain",
    "key_ref": "pilot-local-only",
    "signed_fields": [
      "task_id",
      "project_id",
      "required_capabilities",
      "input_refs",
      "acceptance_criteria"
    ],
    "value": "PLACEHOLDER_SOURCE_PROOF"
  }
}
